{
  "$schema": "http://json-schema.org/draft-07/schema#",
  "$id": "https://quantstudio.local/schemas/run_card.schema.json",
  "title": "QuantStudio Strategy Compiler Run Card v1 (stage enum extended for R5.5 robustness and R5.4 optimization, 2026-08-28; legacy compatibility: consumers must tolerate workspaces/ledgers without robustness or optimization fields — a missing field means the stage was never entered, no error)",
  "type": "object",
  "required": ["run_card_version", "run_id", "strategy_id", "build_id", "created_at", "stage", "status", "contract_versions", "profile", "data_window", "artifacts", "validation", "smoke_backtest", "fidelity", "approximations", "known_limitations", "reproducibility"],
  "properties": {
    "run_card_version": {"const": "1.0"},
    "run_id": {"type": "string", "minLength": 1},
    "strategy_id": {"type": "string", "pattern": "^[a-z][a-z0-9_]{2,63}$"},
    "build_id": {"type": "string", "minLength": 1},
    "created_at": {"type": "string", "format": "date-time"},
    "stage": {"enum": ["SPEC_ONLY", "STATIC_VALIDATED", "SMOKE_EXECUTED", "FIDELITY_COMPARED", "BACKTEST_PASS", "ROBUSTNESS_PASS", "ROBUSTNESS_FAILED", "OPTIMIZATION_PASS", "OPTIMIZATION_PROPOSED", "OPTIMIZATION_FAILED"]},
    "status": {"enum": ["PASS", "PARTIAL", "BLOCKED", "FAILED"]},
    "contract_versions": {"$ref": "#/definitions/contractVersions"},
    "profile": {
      "type": "object",
      "required": ["engine_profile_id", "ptrade_profile_id", "execution_status"],
      "properties": {"engine_profile_id": {"type": "string", "minLength": 1}, "ptrade_profile_id": {"type": "string", "minLength": 1}, "execution_status": {"enum": ["READY", "BLOCKED", "PLANNED", "UNSUPPORTED"]}},
      "additionalProperties": false
    },
    "data_window": {
      "type": "object",
      "required": ["start", "end", "as_of"],
      "properties": {"start": {"type": ["string", "null"], "format": "date"}, "end": {"type": ["string", "null"], "format": "date"}, "as_of": {"type": ["string", "null"], "format": "date-time"}},
      "additionalProperties": false
    },
    "artifacts": {"type": "array", "items": {"type": "object", "required": ["name", "path", "sha256"], "properties": {"name": {"type": "string", "minLength": 1}, "path": {"type": "string", "minLength": 1}, "sha256": {"type": ["string", "null"], "pattern": "^[a-f0-9]{64}$"}}, "additionalProperties": false}},
    "validation": {
      "type": "object",
      "required": ["schema", "timing", "hard_filters", "api_portability", "variant_consistency"],
      "properties": {"schema": {"$ref": "#/definitions/checkStatus"}, "timing": {"$ref": "#/definitions/checkStatus"}, "hard_filters": {"$ref": "#/definitions/checkStatus"}, "api_portability": {"$ref": "#/definitions/checkStatus"}, "variant_consistency": {"$ref": "#/definitions/checkStatus"}},
      "additionalProperties": false
    },
    "smoke_backtest": {"oneOf": [{"type": "null"}, {"$ref": "#/definitions/smokeResult"}]},
    "fidelity": {"oneOf": [{"type": "null"}, {"$ref": "#/definitions/fidelityResult"}]},
    "approximations": {"type": "array", "items": {"type": "string"}},
    "known_limitations": {"type": "array", "items": {"type": "string"}},
    "reproducibility": {
      "type": "object",
      "required": ["python_version", "quantstudio_version", "random_seed", "data_fingerprint"],
      "properties": {"python_version": {"type": "string", "minLength": 1}, "quantstudio_version": {"type": "string", "minLength": 1}, "random_seed": {"type": ["integer", "null"]}, "data_fingerprint": {"type": ["string", "null"]}},
      "additionalProperties": false
    }
  },
  "definitions": {
    "semver": {"type": "string", "pattern": "^[0-9]+\\.[0-9]+\\.[0-9]+(?:-[0-9A-Za-z.-]+)?$"},
    "contractVersions": {"type": "object", "required": ["strategy_spec_version", "engine_semantics_version", "provider_contract_version", "security_code_rules_version", "ptrade_profile_version", "renderer_version", "skill_version"], "properties": {"strategy_spec_version": {"$ref": "#/definitions/semver"}, "engine_semantics_version": {"$ref": "#/definitions/semver"}, "provider_contract_version": {"$ref": "#/definitions/semver"}, "security_code_rules_version": {"$ref": "#/definitions/semver"}, "ptrade_profile_version": {"$ref": "#/definitions/semver"}, "renderer_version": {"$ref": "#/definitions/semver"}, "skill_version": {"$ref": "#/definitions/semver"}}, "additionalProperties": false},
    "checkStatus": {"enum": ["PASS", "BLOCKED", "NOT_RUN", "FAILED"]},
    "smokeResult": {"type": "object", "required": ["status", "command", "summary"], "properties": {"status": {"enum": ["PASS", "BLOCKED", "FAILED"]}, "command": {"type": "string"}, "summary": {"type": "string"}}, "additionalProperties": false},
    "fidelityResult": {"type": "object", "required": ["status", "report_path", "summary"], "properties": {"status": {"enum": ["PASS", "PARTIAL", "FAILED"]}, "report_path": {"type": "string"}, "summary": {"type": "string"}}, "additionalProperties": false}
  },
  "additionalProperties": false
}
